{
  "format_version": "1.0",
  "title": "稻香",
  "artist": "周杰伦",
  "album": "魔杰座",
  "duration": 223,
  "source_url": "https://y.qq.com/n/ryqq/songDetail/001qvvgF38HVc4",
  "source_platform": "qqmusic",
  "audio_codec": "mp3",
  "audio_bitrate": 320,
  "created_at": "2026-07-01T12:00:00Z",
  "tags": ["流行", "华语"]
}
